{
  "schema_version": "acp.v1",
  "document_type": "pm-analysis",
  "artifact_id": "urn:toss:artifact:pm-analysis:common-schema-test",
  "revision": 1,
  "run_id": "run-common-001",
  "producer": {
    "role": "pm",
    "identity": "pm-agent"
  },
  "runtime_identity": {
    "kind": "agent",
    "name": "provider-neutral-test-model",
    "version": "1"
  },
  "created_at": "2026-08-17T12:00:00.000Z",
  "provenance": {
    "source": {
      "file": "docs/brief.md",
      "section": "Scope",
      "location": "lines 1-12"
    },
    "source_revision": "git:2f3a4b5c",
    "source_sha256": "aaaaaaaaaaaaaaaaaaaaaaaaaaaaaaaaaaaaaaaaaaaaaaaaaaaaaaaaaaaaaaaa",
    "agent": {
      "identity": "pm-agent",
      "model": "provider-neutral-test-model",
      "run_id": "run-common-001"
    },
    "timestamp": "2026-08-17T12:00:00.000Z",
    "confidence": 0.95
  },
  "parents": [],
  "inputs": [],
  "content_sha256": "bbbbbbbbbbbbbbbbbbbbbbbbbbbbbbbbbbbbbbbbbbbbbbbbbbbbbbbbbbbbbbbb",
  "content": {
    "entities": ["REQ-001"]
  }
}
